{
  "generated_at": "2026-09-07T01:40:05.321416+00:00",
  "run_count": 30,
  "runs": [
    {
      "caveats": [
        "Cold-load control is available only for local lifecycle-managed runtimes; hosted-provider latency is directional, not equivalent.",
        "Imported from a historical cohort result; the bundle is normalized evidence, not a rerun."
      ],
      "cohort": "titan-local",
      "dimensions": {},
      "display_name": "cydonia-24b-v4.3",
      "efficiency": {
        "cold_start_seconds": 27.967421191999165,
        "cold_ttft_seconds": 0.005088760997750796,
        "median_task_seconds": 37.183,
        "tasks_per_minute": 1.6136,
        "total_seconds": 37.183,
        "workload_seconds": 9.215588352999475,
        "workload_ttft_seconds": 2.350872294999135
      },
      "endpoint_class": "llama.cpp",
      "exactness": {
        "contract": 0,
        "core": 1,
        "strict": 0,
        "total": 1
      },
      "failure_counts": {
        "tool_protocol_failure": 1
      },
      "manifest_path": "runs/20260812t015120-latency-cydonia-24b-v4-3-r1/manifest.json",
      "model": "cydonia-24b-v4.3",
      "provider": "Titan",
      "provider_kind": "local",
      "provider_reported_cost_usd": null,
      "reliability": {
        "evaluated": 1,
        "evaluated_pass_rate": 0.0,
        "scheduled": 1,
        "scheduled_pass_rate": 0.0
      },
      "replicate": {
        "count": 1,
        "index": 1,
        "seed": 42
      },
      "reproducibility": {
        "fixture_sha256": null,
        "prompt_sha256": "1424e431a5061a12479bc53fcec60050baa8009840d27007c9109813c29fcbbb",
        "runner_commit": "7362428bf3ca09c95423d2c2c1c5dd11bea534d8",
        "runner_dirty": true,
        "seed_document_sha256": "56994618c221c496c6c7e812d4a8605158836880e554c9ff23ae0b09e52060c4",
        "tasks_sha256": "f417029b6283e23974e4a1f58a8b0f44294af6ba28e421b272dc2edf752f0aea",
        "tool_schema_sha256": "ff9794396f5cd5d59d82b27fad8325f2fac2df7a647eda762261a1c02cad3e55"
      },
      "run_id": "20260812t015120-latency-cydonia-24b-v4-3-r1",
      "score": 50.0,
      "started_at": "2026-08-12T01:51:20.432340-04:00",
      "status": "ok",
      "suite": "latency",
      "suite_version": "1.0",
      "summary_path": "runs/20260812t015120-latency-cydonia-24b-v4-3-r1/summary.json",
      "task_results_path": "runs/20260812t015120-latency-cydonia-24b-v4-3-r1/task-results.jsonl"
    },
    {
      "caveats": [
        "Cold-load control is available only for local lifecycle-managed runtimes; hosted-provider latency is directional, not equivalent.",
        "Imported from a historical cohort result; the bundle is normalized evidence, not a rerun."
      ],
      "cohort": "titan-local",
      "dimensions": {},
      "display_name": "dolphin-mistral-24b-venice",
      "efficiency": {
        "cold_start_seconds": 17.65202158899774,
        "cold_ttft_seconds": 0.0032104339989018627,
        "median_task_seconds": 18.6726,
        "tasks_per_minute": 3.2133,
        "total_seconds": 18.6726,
        "workload_seconds": 1.020600588999514,
        "workload_ttft_seconds": 0.6275144590035779
      },
      "endpoint_class": "llama.cpp",
      "exactness": {
        "contract": 0,
        "core": 1,
        "strict": 0,
        "total": 1
      },
      "failure_counts": {
        "tool_protocol_failure": 1
      },
      "manifest_path": "runs/20260812t015120-latency-dolphin-mistral-24b-venice-r1/manifest.json",
      "model": "dolphin-mistral-24b-venice",
      "provider": "Titan",
      "provider_kind": "local",
      "provider_reported_cost_usd": null,
      "reliability": {
        "evaluated": 1,
        "evaluated_pass_rate": 0.0,
        "scheduled": 1,
        "scheduled_pass_rate": 0.0
      },
      "replicate": {
        "count": 1,
        "index": 1,
        "seed": 42
      },
      "reproducibility": {
        "fixture_sha256": null,
        "prompt_sha256": "1424e431a5061a12479bc53fcec60050baa8009840d27007c9109813c29fcbbb",
        "runner_commit": "7362428bf3ca09c95423d2c2c1c5dd11bea534d8",
        "runner_dirty": true,
        "seed_document_sha256": "56994618c221c496c6c7e812d4a8605158836880e554c9ff23ae0b09e52060c4",
        "tasks_sha256": "f417029b6283e23974e4a1f58a8b0f44294af6ba28e421b272dc2edf752f0aea",
        "tool_schema_sha256": "ff9794396f5cd5d59d82b27fad8325f2fac2df7a647eda762261a1c02cad3e55"
      },
      "run_id": "20260812t015120-latency-dolphin-mistral-24b-venice-r1",
      "score": 50.0,
      "started_at": "2026-08-12T01:51:20.432340-04:00",
      "status": "ok",
      "suite": "latency",
      "suite_version": "1.0",
      "summary_path": "runs/20260812t015120-latency-dolphin-mistral-24b-venice-r1/summary.json",
      "task_results_path": "runs/20260812t015120-latency-dolphin-mistral-24b-venice-r1/task-results.jsonl"
    },
    {
      "caveats": [
        "Cold-load control is available only for local lifecycle-managed runtimes; hosted-provider latency is directional, not equivalent.",
        "Imported from a historical cohort result; the bundle is normalized evidence, not a rerun."
      ],
      "cohort": "titan-local",
      "dimensions": {},
      "display_name": "empero-ai-qwythos-9b-claude-mythos-5-1m-gguf-qwythos-9b-claude-mythos-5-1m-mtp-q4-k-m",
      "efficiency": {
        "cold_start_seconds": 97.61175223300233,
        "cold_ttft_seconds": 0.0014789390043006279,
        "median_task_seconds": 252.813,
        "tasks_per_minute": 0.2373,
        "total_seconds": 252.813,
        "workload_seconds": 155.2012724169981,
        "workload_ttft_seconds": 0.03919271699851379
      },
      "endpoint_class": "llama.cpp",
      "exactness": {
        "contract": 1,
        "core": 1,
        "strict": 1,
        "total": 1
      },
      "failure_counts": {
        "pass": 1
      },
      "manifest_path": "runs/20260812t015120-latency-empero-ai-qwythos-9b-claude-mythos-5-1m-gguf-qwythos-9b-claude-mythos-5-r1/manifest.json",
      "model": "empero-ai-qwythos-9b-claude-mythos-5-1m-gguf-qwythos-9b-claude-mythos-5-1m-mtp-q4-k-m",
      "provider": "Titan",
      "provider_kind": "local",
      "provider_reported_cost_usd": null,
      "reliability": {
        "evaluated": 1,
        "evaluated_pass_rate": 100.0,
        "scheduled": 1,
        "scheduled_pass_rate": 100.0
      },
      "replicate": {
        "count": 1,
        "index": 1,
        "seed": 42
      },
      "reproducibility": {
        "fixture_sha256": null,
        "prompt_sha256": "1424e431a5061a12479bc53fcec60050baa8009840d27007c9109813c29fcbbb",
        "runner_commit": "7362428bf3ca09c95423d2c2c1c5dd11bea534d8",
        "runner_dirty": true,
        "seed_document_sha256": "56994618c221c496c6c7e812d4a8605158836880e554c9ff23ae0b09e52060c4",
        "tasks_sha256": "f417029b6283e23974e4a1f58a8b0f44294af6ba28e421b272dc2edf752f0aea",
        "tool_schema_sha256": "ff9794396f5cd5d59d82b27fad8325f2fac2df7a647eda762261a1c02cad3e55"
      },
      "run_id": "20260812t015120-latency-empero-ai-qwythos-9b-claude-mythos-5-1m-gguf-qwythos-9b-claude-mythos-5-r1",
      "score": 100.0,
      "started_at": "2026-08-12T01:51:20.432340-04:00",
      "status": "ok",
      "suite": "latency",
      "suite_version": "1.0",
      "summary_path": "runs/20260812t015120-latency-empero-ai-qwythos-9b-claude-mythos-5-1m-gguf-qwythos-9b-claude-mythos-5-r1/summary.json",
      "task_results_path": "runs/20260812t015120-latency-empero-ai-qwythos-9b-claude-mythos-5-1m-gguf-qwythos-9b-claude-mythos-5-r1/task-results.jsonl"
    },
    {
      "caveats": [
        "Cold-load control is available only for local lifecycle-managed runtimes; hosted-provider latency is directional, not equivalent.",
        "Imported from a historical cohort result; the bundle is normalized evidence, not a rerun."
      ],
      "cohort": "titan-local",
      "dimensions": {},
      "display_name": "gemma-4-12b-obliterated",
      "efficiency": {
        "cold_start_seconds": 11.65942994600482,
        "cold_ttft_seconds": 0.004682411999965552,
        "median_task_seconds": 14.151,
        "tasks_per_minute": 4.24,
        "total_seconds": 14.151,
        "workload_seconds": 2.4915786320052575,
        "workload_ttft_seconds": 0.9312468170028296
      },
      "endpoint_class": "llama.cpp",
      "exactness": {
        "contract": 1,
        "core": 1,
        "strict": 1,
        "total": 1
      },
      "failure_counts": {
        "pass": 1
      },
      "manifest_path": "runs/20260812t015120-latency-gemma-4-12b-obliterated-r1/manifest.json",
      "model": "gemma-4-12b-obliterated",
      "provider": "Titan",
      "provider_kind": "local",
      "provider_reported_cost_usd": null,
      "reliability": {
        "evaluated": 1,
        "evaluated_pass_rate": 100.0,
        "scheduled": 1,
        "scheduled_pass_rate": 100.0
      },
      "replicate": {
        "count": 1,
        "index": 1,
        "seed": 42
      },
      "reproducibility": {
        "fixture_sha256": null,
        "prompt_sha256": "1424e431a5061a12479bc53fcec60050baa8009840d27007c9109813c29fcbbb",
        "runner_commit": "7362428bf3ca09c95423d2c2c1c5dd11bea534d8",
        "runner_dirty": true,
        "seed_document_sha256": "56994618c221c496c6c7e812d4a8605158836880e554c9ff23ae0b09e52060c4",
        "tasks_sha256": "f417029b6283e23974e4a1f58a8b0f44294af6ba28e421b272dc2edf752f0aea",
        "tool_schema_sha256": "ff9794396f5cd5d59d82b27fad8325f2fac2df7a647eda762261a1c02cad3e55"
      },
      "run_id": "20260812t015120-latency-gemma-4-12b-obliterated-r1",
      "score": 100.0,
      "started_at": "2026-08-12T01:51:20.432340-04:00",
      "status": "ok",
      "suite": "latency",
      "suite_version": "1.0",
      "summary_path": "runs/20260812t015120-latency-gemma-4-12b-obliterated-r1/summary.json",
      "task_results_path": "runs/20260812t015120-latency-gemma-4-12b-obliterated-r1/task-results.jsonl"
    },
    {
      "caveats": [